name,coupon,call_date,rating,type_of_bond,yeild,price
ASIRVAD MICRO FINANCE LIMITED,11.90%,Jun 2026,CRISIL  AA-,Subordinate Debt Tier 2,10.90%,"₹ 1,05,995"
HINDUJA LEYLAND FINANCE LIMITED,10.15%,Mar 2025,CARE  AA-,Subordinate Debt,9.75%,"₹ 10,37,617"
U.P. POWER CORPORATION LIMITED,10.15%,Jan 2025,Ind-Ra  A+(CE),State Guaranteed Bond (SLU),9.38%,"₹ 10,49,391"
ESS KAY FINCORP LIMITED,0.00%,Mar 2026,ICRA  PP-MLD  AA + r (CE),Market Linked Debentures,8.90%,"₹ 1,02,699"
JM FINANCIAL CREDIT SOLUTIONS LIMITED,11.60%,Jul 2024,ICRA  AA,Floating Rate Bond,8.64%,"₹ 10,09,999"
U.P. POWER CORPORATION LIMITED,8.97%,Feb 2025,BWR  AA(CE),State Guaranteed Bond (SLU),7.30%,"₹ 10,65,170"
STATE BANK OF INDIA,8.75%,Aug 2024,ICRA  AA+,Bank AT1 Perpetual Bond,7.27%,"₹ 11,13,065"
LIC HOUSING FINANCE LIMITED,7.79%,Oct 2024,CARE  AAA,Regular Bond/Debenture,6.15%,"₹ 11,01,658"
POWER FINANCE CORPORATION LTD.,8.65%,Dec 2024,CARE  AAA,Regular Bond/Debenture,6.15%,"₹ 11,19,320"
