,Fund name,category,aum_rs_cr,1_w_pr,1_m_pr,3_m_pr,6_m_pr,1_y_pr,3_y_pr,5_y_pr
0,Quant Small Cap Fund,Equity-Diversified,700.52,0.16,9.79,36.1,65.19,171.05,33.67,21.37
1,ICICI Prudential Commodities Fund,Equity-Sector,533.37,-0.9,4.74,27.84,50.29,137.68,--,--
2,Quant Infrastructure Fund,Equity-Sector,42.67,-0.93,1.5,20.09,40.2,130.74,27.88,20.74
3,                            Sundaram Long Term Micro Cap Tax Advanta...                        ,Equity-Tax Planning,42.81,0.47,12.85,40.98,54.54,118.96,14.56,--
4,Sundaram Select Micro Cap - Series XVII,Equity-Diversified,98.53,0.37,11.64,34.74,49.77,118.23,15.09,--
5,                            Sundaram Long Term Micro Cap Tax Advanta...                        ,Equity-Tax Planning,42.16,-0.53,11.99,38.83,51.57,118.19,14.98,--
6,Kotak Small Cap Fund,Equity-Diversified,4765.5,-0.02,5.2,23.23,41.23,116.84,26.35,19.87
7,Sundaram Select Micro Cap - Series XVI,Equity-Diversified,116.36,0.51,11.63,33.66,47.96,116.03,15.21,--
8,BOI AXA Small Cap Fund,Equity-Diversified,158.22,0.55,8.8,27.86,43.99,113.27,--,--
9,                            Sundaram Long Term Micro Cap Tax Advanta...                        ,Equity-Tax Planning,40.26,-0.41,12.37,37.54,49.2,112.06,14.24,--
10,Quant Mid Cap Fund,Balanced,110.32,-1.22,3.78,21.62,33.39,88.32,23.47,18.57
11,BOI AXA Mid & Small Cap Equity & Debt Fund,Balanced,333.09,0.93,7.97,24.54,35.27,82.25,17.19,--
12,Quant Absolute Fund,Balanced,52.52,0.51,3.73,16.93,27.79,80.34,25.70,18.25
13,IDFC Hybrid Equity Fund,Balanced,545.26,-0.38,2.53,12.83,14.63,47.55,11.46,--
14,ICICI Prudential Equity & Debt Fund,Balanced,17129.99,-1.5,0.46,11.31,17.52,46.72,14.81,13.36
15,Kotak Equity Hybrid Fund,Balanced,1760.44,-1.0,0.6,8.73,14.28,46.44,14.74,12.43
16,UTI Hybrid Equity Fund,Balanced,4046.04,-0.66,2.03,12.58,15.54,44.46,11.65,10.91
17,                            Mahindra Manulife Hybrid Equity Nivesh Y...                        ,Balanced,232.54,-0.87,1.7,11.69,15.81,43.62,--,--
18,                            Aditya Birla Sun Life Equity Hybrid 95 F...                        ,Balanced,7875.59,-0.76,1.84,10.51,12.18,43.42,10.53,10.17
19,HDFC Childrens Gift Fund,Balanced,4835.85,-0.97,2.23,13.92,15.33,42.99,14.61,14.06
20,HDFC Multi - Asset Fund,Debt-MIP,905.13,-0.49,1.65,8.4,8.23,29.94,12.70,10.54
21,Aditya Birla Sun Life Regular Savings Fund,Debt-MIP,1210.29,0.02,0.78,4.04,5.76,21.77,7.46,7.92
22,HDFC Hybrid Debt Fund,Debt-MIP,2525.39,0.13,1.24,6.28,7.88,19.71,10.22,8.40
23,SBI Multi Asset Allocation Fund,Debt-MIP,393.27,-0.05,1.31,7.92,7.36,18.96,11.59,9.42
24,SBI Debt Hybrid Fund,Debt-MIP,1845.46,-0.05,1.22,4.77,6.21,18.86,10.04,8.33
25,IDBI Equity Savings Fund,Debt-MIP,11.26,-0.51,0.76,4.47,4.44,18.8,7.79,6.00
26,Kotak Debt Hybrid Fund,Debt-MIP,678.23,0.44,0.87,4.97,5.95,18.46,11.28,9.32
27,Nippon India Strategic Debt Fund,Debt-Income,251.72,0.29,13.99,14.98,15.44,17.95,-4.33,0.10
28,UTI Dual Advantage FTF - Series IV - IV,Debt-Marginal Equity,29.42,-0.22,1.02,5.4,7.91,17.78,11.30,--
29,UTI Regular Savings Fund,Debt-MIP,1636.92,-0.02,0.84,4.09,4.2,17.47,6.14,7.16
30,Nippon India Ultra Short Duration Fund,Liquid,1238.04,0.11,2.78,4.61,5.88,9.52,5.08,5.50
31,Quant Liquid Fund,Liquid,268.85,0.06,0.28,0.96,2.01,4.3,5.89,6.28
32,Tata Money Market Fund,Liquid,3864.31,0.08,0.36,1.02,2.11,4.2,4.10,5.24
33,Aditya Birla Sun Life Money Manager Fund,Liquid,13621.81,0.07,0.34,1.0,2.04,4.11,6.85,6.92
34,Nippon India Money Market Fund,Liquid,7318.39,0.06,0.34,0.96,1.98,4.0,6.63,6.75
35,UTI Money Market Fund,Liquid,6635.55,0.06,0.34,0.95,1.96,3.98,6.59,6.73
36,Axis Money Market Fund,Liquid,2306.68,0.07,0.34,0.96,1.97,3.98,--,--
37,HDFC Money Market Fund,Liquid,13853.92,0.07,0.33,0.99,1.99,3.97,6.74,6.72
38,ICICI Prudential Money Market Fund,Liquid,11429.87,0.06,0.32,0.95,1.93,3.9,6.57,6.71
39,Kotak Money Market Fund,Liquid,9730.07,0.07,0.34,0.94,1.92,3.84,6.45,6.64
40,Edelweiss Government Securities Fund,Gilt-Long Term,98.29,0.22,0.47,1.37,2.56,6.23,10.42,8.45
41,Axis Gilt Fund,Gilt-Long Term,152.86,0.26,0.23,1.09,0.75,3.93,10.24,7.64
42,                            ICICI Prudential Constant Maturity Gilt ...                        ,Gilt-Long Term,324.98,0.21,0.2,1.74,0.99,3.63,11.33,9.23
43,DSP Government Securities Fund,Gilt-Long Term,461.95,0.28,0.29,1.42,1.18,3.62,10.66,8.53
44,                            Aditya Birla Sun Life Government Securit...                        ,Gilt-Long Term,880.65,0.36,0.04,1.4,1.35,3.26,9.89,8.53
45,SBI Magnum Gilt Fund,Gilt-Long Term,3711.19,0.09,0.15,0.93,1.35,3.24,10.07,8.67
46,PGIM India Gilt Fund,Gilt-Long Term,132.01,0.2,0.2,1.35,1.36,3.22,8.49,7.26
47,LIC MF G Sec Fund,Gilt-Long Term,48.03,0.2,0.31,1.31,1.36,3.15,9.59,7.63
48,                            IDFC Government Securities Fund Investme...                        ,Gilt-Long Term,1968.55,0.38,0.59,1.8,0.97,2.98,11.24,9.01
49,Kotak Gilt Fund,Gilt-Long Term,864.72,0.24,0.0,1.12,-0.09,2.93,9.45,7.56
50,Quant Multi Asset Fund,Dynamic/Asset Allocation,74.36,-1.06,3.52,19.83,41.95,81.99,27.26,17.36
51,HDFC Balanced Advantage Fund,Dynamic/Asset Allocation,41796.27,-0.79,0.9,13.25,15.28,45.34,13.24,12.86
52,ICICI Prudential Multi-Asset Fund,Dynamic/Asset Allocation,11676.83,-1.63,-0.04,9.92,15.09,39.26,13.80,12.91
53,Edelweiss Aggressive Hybrid Fund,Dynamic/Asset Allocation,56.65,-0.74,2.04,11.32,12.03,38.6,12.36,11.64
54,Tata Multi Asset Opportunities Fund,Dynamic/Asset Allocation,792.59,-0.37,1.5,8.82,11.05,34.97,--,--
55,Axis Triple Advantage Fund,Dynamic/Asset Allocation,1020.42,-0.65,2.17,10.64,9.97,34.64,13.82,11.38
56,Edelweiss Balanced Advantage Fund,Dynamic/Asset Allocation,4308.73,-0.56,1.05,7.36,8.09,29.58,13.20,12.31
57,Nippon India Balanced Advantage Fund,Dynamic/Asset Allocation,3722.21,-0.04,1.62,8.38,9.54,28.2,11.01,11.19
58,                            Nippon India Capital Protection Oriented...                        ,Dynamic/Asset Allocation,36.26,-1.12,-0.6,7.55,5.68,27.67,--,--
59,Baroda Dynamic Equity Fund,Dynamic/Asset Allocation,1248.07,-0.07,1.88,5.86,5.71,26.6,--,--
60,Nippon India ETF Nifty Midcap 150,ETF-Others,402.67,-1.35,2.28,16.64,24.94,76.86,--,--
61,Motilal Oswal Midcap 100 ETF,ETF-Others,69.63,-1.39,2.07,16.95,24.22,76.33,15.26,13.84
62,ICICI Prudential Midcap 150 ETF,ETF-Others,74.69,-1.33,2.32,16.76,25.02,75.85,--,--
63,Nippon India ETF Nifty IT,ETF-Others,706.66,-0.25,3.21,13.69,11.25,71.84,--,--
64,ICICI Prudential Midcap Select ETF,ETF-Others,28.38,-0.72,3.18,13.41,14.53,63.6,13.74,12.96
65,Nippon India ETF PSU Bank BeES,ETF-Others,278.74,-3.72,-3.63,22.83,24.26,61.65,-5.69,-3.73
66,Kotak PSU Bank ETF,ETF-Others,137.38,-3.72,-3.6,22.84,24.5,61.46,-5.86,-3.81
67,SBI ETF Sensex Next 50,ETF-Others,5.74,-0.79,1.06,13.25,15.19,55.88,--,--
68,                            UTI S&P BSE Sensex Next 50 Exchange Trad...                        ,ETF-Others,7.86,-0.79,1.05,13.23,15.13,55.74,--,--
69,Nippon India ETF Sensex Next 50,ETF-Others,17.04,-0.79,1.04,13.18,15.09,55.33,--,--
70,HDFC Retirement Savings Fund - Equity Plan,Speciality-Pension Plan,1668.76,-0.34,4.31,21.63,26.61,66.4,17.95,16.61
71,UTI CCF - Investment Plan,Speciality-Child Care,504.4,-1.23,2.85,14.46,13.65,52.68,13.17,14.56
72,Tata Young Citizens Fund,Speciality-Child Care,249.93,-0.77,1.21,12.66,15.03,48.05,12.83,11.26
73,                            ICICI Prudential Retirement Fund - Pure ...                        ,Speciality-Pension Plan,101.4,1.17,3.9,12.97,11.33,45.94,--,--
74,                            Nippon India Retirement Fund - Wealth Cr...                        ,Speciality-Pension Plan,2106.56,-0.81,1.72,12.72,13.31,44.84,6.61,9.00
75,                            HDFC Retirement Savings Fund - Hybrid - ...                        ,Speciality-Pension Plan,649.89,-0.34,2.37,12.75,15.18,44.13,15.00,14.54
76,LIC MF Unit Linked Insurance scheme,Speciality-ULIP,376.98,-0.95,1.42,10.43,10.54,38.98,10.93,10.88
77,                            Tata Retirement Savings Fund - Progressi...                        ,Speciality-Pension Plan,1088.72,-0.73,0.56,10.97,9.0,36.27,11.19,14.28
78,Axis Childrens Gift Fund,Speciality-Child Care,622.22,-0.14,2.65,10.88,10.78,35.1,12.63,11.72
79,                            Axis Retirement Savings Fund - Aggressiv...                        ,Speciality-Pension Plan,611.06,-0.39,1.57,10.26,9.69,34.62,--,--
80,                            ICICI Prudential Thematic Advantage Fund...                        ,Fund of Funds-Domestic,48.71,-1.33,1.57,17.04,24.58,68.02,17.41,15.82
81,ICICI Prudential India Equity FOF,Fund of Funds-Domestic,32.58,-1.44,1.74,16.7,22.84,61.82,--,--
82,                            ICICI Prudential Passive Strategy Fund (...                        ,Fund of Funds-Domestic,81.9,-1.17,0.32,11.53,12.38,50.48,11.50,12.17
83,ICICI Prudential Bharat 22 FOF,Fund of Funds-Domestic,36.6,-0.94,1.7,17.19,18.64,50.37,5.74,--
84,                            Franklin India Life Stage Fund of Funds ...                        ,Fund of Funds-Domestic,13.93,-0.94,1.63,12.72,17.23,50.12,11.02,10.21
85,Quantum Equity FoF,Fund of Funds-Domestic,69.02,-0.86,2.35,13.11,13.56,46.95,13.47,13.09
86,Nippon India Junior BeES FoF,Fund of Funds-Domestic,76.27,-0.42,0.46,13.13,15.14,46.03,--,--
87,PRINCIPAL Global Opportunities Fund,Fund of Funds-Overseas,35.0,-1.63,2.01,0.14,13.19,45.29,14.19,15.64
88,                            Franklin India Life Stage Fund of Funds ...                        ,Fund of Funds-Domestic,6.04,-0.48,1.99,11.34,19.29,42.87,8.49,8.47
89,HSBC Managed Solutions India - Growth,Fund of Funds-Domestic,42.15,-0.51,1.88,11.81,10.98,41.97,12.29,12.28
